{
  "$schema": "https://json-schema.org/draft/2020-12/schema",
  "$id": "https://videomap.dev/schema/scene.schema.json",
  "title": "VideoMap scene",
  "description": "Input manifest for `vmap build`: the videos to show and how to lay them out.",
  "type": "object",
  "required": [
    "videos"
  ],
  "additionalProperties": false,
  "properties": {
    "$schema": {
      "type": "string"
    },
    "title": {
      "type": "string",
      "maxLength": 500
    },
    "description": {
      "type": "string",
      "maxLength": 20000
    },
    "surface": {
      "type": "object",
      "additionalProperties": false,
      "properties": {
        "type": {
          "enum": [
            "plane",
            "cylinder",
            "sphere"
          ],
          "default": "plane"
        },
        "arc": {
          "type": "number",
          "exclusiveMinimum": 0,
          "maximum": 360,
          "description": "Cylinder: degrees wrapped. Sphere: longitude span."
        },
        "latitudeBand": {
          "type": "array",
          "prefixItems": [
            {
              "type": "number",
              "minimum": -89,
              "maximum": 89
            },
            {
              "type": "number",
              "minimum": -89,
              "maximum": 89
            }
          ],
          "minItems": 2,
          "maxItems": 2,
          "description": "Sphere only: [south, north] latitude limits in degrees."
        },
        "view": {
          "enum": [
            "inside",
            "outside"
          ]
        }
      }
    },
    "preview": {
      "type": "object",
      "additionalProperties": false,
      "properties": {
        "duration": {
          "type": "number",
          "exclusiveMinimum": 0,
          "maximum": 300,
          "description": "Loop length in seconds shared by every tile."
        },
        "fps": {
          "type": "integer",
          "minimum": 1,
          "maximum": 60
        },
        "startStrategy": {
          "enum": [
            "auto",
            "start"
          ],
          "description": "\"auto\" skips roughly the first 10% of long videos."
        },
        "loopShort": {
          "type": "boolean",
          "description": "Loop clips shorter than the preview duration (otherwise hold the last frame)."
        }
      }
    },
    "layout": {
      "type": "object",
      "additionalProperties": false,
      "properties": {
        "pack": {
          "enum": [
            "grid",
            "masonry"
          ],
          "description": "\"grid\": uniform cells. \"masonry\": fixed-width columns, each video at its own aspect."
        },
        "cellAspect": {
          "type": "string",
          "pattern": "^\\d+(\\.\\d+)?[:/]\\d+(\\.\\d+)?$",
          "description": "Grid only: aspect of each cell."
        },
        "aspect": {
          "type": "string",
          "pattern": "^\\d+(\\.\\d+)?[:/]\\d+(\\.\\d+)?$",
          "description": "Overall wall aspect when output.canvas is not set."
        },
        "fit": {
          "enum": [
            "cover",
            "contain"
          ],
          "description": "Grid only: \"contain\" letterboxes the whole frame (default), \"cover\" crops to fill the cell."
        },
        "columnWidth": {
          "type": "integer",
          "minimum": 32,
          "maximum": 2048,
          "description": "Masonry only: column width in pixels at full zoom."
        },
        "gap": {
          "type": "integer",
          "minimum": 0,
          "maximum": 256,
          "description": "Masonry only: gutter between videos in pixels at full zoom."
        },
        "groupArrange": {
          "enum": [
            "columns",
            "bands"
          ],
          "description": "Masonry only: groups side by side as column groups, or stacked as full-width bands."
        },
        "avoidSplits": {
          "type": "boolean",
          "description": "Masonry only: move a video down rather than let it cross a tile edge, when it fits in one tile."
        },
        "groupBy": {
          "type": "string",
          "pattern": "^(none|category|tag:.+|meta\\..+)$"
        },
        "sortBy": {
          "type": "array",
          "items": {
            "type": "string",
            "pattern": "^-?(id|title|duration|category|src|meta\\..+)$"
          }
        },
        "groupGap": {
          "type": "integer",
          "minimum": 0,
          "maximum": 10,
          "description": "Empty cells (grid, default 1) or whole columns (masonry, default 0) between groups."
        },
        "labels": {
          "type": "boolean"
        },
        "label": {
          "type": "string",
          "maxLength": 80,
          "description": "Name of this arrangement in the viewer layout switcher, e.g. \"By place\"."
        }
      }
    },
    "layouts": {
      "type": "array",
      "maxItems": 8,
      "description": "Alternate arrangements of the same videos, each built as its own tile pyramid. The viewer switches between them.",
      "items": {
        "type": "object",
        "required": [
          "id"
        ],
        "additionalProperties": false,
        "properties": {
          "id": {
            "type": "string",
            "pattern": "^[A-Za-z0-9][A-Za-z0-9._-]{0,127}$",
            "description": "URL-safe identifier"
          },
          "pack": {
            "enum": [
              "grid",
              "masonry"
            ],
            "description": "\"grid\": uniform cells. \"masonry\": fixed-width columns, each video at its own aspect."
          },
          "cellAspect": {
            "type": "string",
            "pattern": "^\\d+(\\.\\d+)?[:/]\\d+(\\.\\d+)?$",
            "description": "Grid only: aspect of each cell."
          },
          "aspect": {
            "type": "string",
            "pattern": "^\\d+(\\.\\d+)?[:/]\\d+(\\.\\d+)?$",
            "description": "Overall wall aspect when output.canvas is not set."
          },
          "fit": {
            "enum": [
              "cover",
              "contain"
            ],
            "description": "Grid only: \"contain\" letterboxes the whole frame (default), \"cover\" crops to fill the cell."
          },
          "columnWidth": {
            "type": "integer",
            "minimum": 32,
            "maximum": 2048,
            "description": "Masonry only: column width in pixels at full zoom."
          },
          "gap": {
            "type": "integer",
            "minimum": 0,
            "maximum": 256,
            "description": "Masonry only: gutter between videos in pixels at full zoom."
          },
          "groupArrange": {
            "enum": [
              "columns",
              "bands"
            ],
            "description": "Masonry only: groups side by side as column groups, or stacked as full-width bands."
          },
          "avoidSplits": {
            "type": "boolean",
            "description": "Masonry only: move a video down rather than let it cross a tile edge, when it fits in one tile."
          },
          "groupBy": {
            "type": "string",
            "pattern": "^(none|category|tag:.+|meta\\..+)$"
          },
          "sortBy": {
            "type": "array",
            "items": {
              "type": "string",
              "pattern": "^-?(id|title|duration|category|src|meta\\..+)$"
            }
          },
          "groupGap": {
            "type": "integer",
            "minimum": 0,
            "maximum": 10,
            "description": "Empty cells (grid, default 1) or whole columns (masonry, default 0) between groups."
          },
          "labels": {
            "type": "boolean"
          },
          "label": {
            "type": "string",
            "maxLength": 80,
            "description": "Name of this arrangement in the viewer layout switcher, e.g. \"By place\"."
          }
        }
      }
    },
    "output": {
      "type": "object",
      "additionalProperties": false,
      "properties": {
        "canvas": {
          "anyOf": [
            {
              "type": "string",
              "pattern": "^\\d+[xX]\\d+$",
              "description": "Pixel size as WIDTHxHEIGHT, e.g. 768x432"
            },
            {
              "type": "null"
            }
          ],
          "description": "Full-resolution wall size; the cell size is derived from it."
        },
        "cell": {
          "anyOf": [
            {
              "type": "string",
              "pattern": "^\\d+[xX]\\d+$",
              "description": "Pixel size as WIDTHxHEIGHT, e.g. 768x432"
            },
            {
              "type": "null"
            }
          ],
          "description": "Size of one video at full zoom; alternative to canvas."
        },
        "tile": {
          "type": "string",
          "pattern": "^\\d+[xX]\\d+$",
          "description": "Target tile video size (default 768x432 for grid, 768x1024 for masonry)."
        },
        "tileCrf": {
          "type": "integer",
          "minimum": 10,
          "maximum": 51
        },
        "tileCodecs": {
          "type": "array",
          "items": {
            "enum": [
              "h264",
              "vp9"
            ]
          },
          "minItems": 1,
          "uniqueItems": true,
          "description": "Tile codecs in order of preference; the viewer plays the first one the browser supports. H.264 plays everywhere."
        },
        "background": {
          "type": "string",
          "pattern": "^#[0-9a-fA-F]{6}$"
        },
        "stills": {
          "type": "boolean"
        },
        "full": {
          "type": "object",
          "additionalProperties": false,
          "properties": {
            "enabled": {
              "type": "boolean",
              "description": "false builds tiles only: no media/ folder, and the viewer shows an info card instead of a player."
            },
            "maxHeight": {
              "type": "integer",
              "minimum": 144,
              "maximum": 4320
            },
            "crf": {
              "type": "integer",
              "minimum": 10,
              "maximum": 51
            }
          }
        }
      }
    },
    "build": {
      "type": "object",
      "additionalProperties": false,
      "description": "How to build, not what: CLI flags and Studio settings override these.",
      "properties": {
        "hardware": {
          "enum": [
            "auto",
            "off",
            "nvenc",
            "qsv",
            "amf",
            "videotoolbox",
            "vaapi"
          ],
          "description": "H.264 hardware encoder. \"auto\" uses the first one that passes a test encode, falling back to libx264."
        },
        "hardwareFinal": {
          "type": "boolean",
          "description": "Also use hardware for the final tiles (default false: they stay on libx264, which was faster overall and smaller)."
        },
        "hardwareJobs": {
          "type": "integer",
          "minimum": 1,
          "maximum": 32,
          "description": "Concurrent hardware encode sessions."
        }
      }
    },
    "categories": {
      "type": "array",
      "items": {
        "type": "object",
        "required": [
          "id"
        ],
        "additionalProperties": false,
        "properties": {
          "id": {
            "type": "string",
            "pattern": "^[A-Za-z0-9][A-Za-z0-9._-]{0,127}$",
            "description": "URL-safe identifier"
          },
          "label": {
            "type": "string"
          },
          "color": {
            "type": "string",
            "pattern": "^#[0-9a-fA-F]{6}$"
          },
          "description": {
            "type": "string",
            "maxLength": 20000
          }
        }
      }
    },
    "videos": {
      "type": "array",
      "minItems": 1,
      "items": {
        "type": "object",
        "required": [
          "src"
        ],
        "additionalProperties": false,
        "properties": {
          "id": {
            "type": "string",
            "pattern": "^[A-Za-z0-9][A-Za-z0-9._-]{0,127}$",
            "description": "URL-safe identifier"
          },
          "src": {
            "type": "string",
            "minLength": 1,
            "description": "Path relative to the scene file, or an http(s) URL."
          },
          "title": {
            "type": "string",
            "maxLength": 500
          },
          "description": {
            "type": "string",
            "maxLength": 20000
          },
          "categories": {
            "type": "array",
            "items": {
              "type": "string"
            }
          },
          "tags": {
            "type": "array",
            "items": {
              "type": "string"
            }
          },
          "previewStart": {
            "type": "number",
            "minimum": 0
          },
          "fit": {
            "enum": [
              "cover",
              "contain"
            ],
            "description": "Grid only: overrides layout.fit for this video."
          },
          "poster": {
            "type": "string"
          },
          "credits": {
            "type": "object",
            "additionalProperties": false,
            "properties": {
              "author": {
                "type": "string"
              },
              "license": {
                "type": "string"
              },
              "url": {
                "type": "string"
              }
            }
          },
          "links": {
            "type": "array",
            "items": {
              "type": "object",
              "required": [
                "href"
              ],
              "additionalProperties": false,
              "properties": {
                "label": {
                  "type": "string"
                },
                "href": {
                  "type": "string"
                }
              }
            }
          },
          "meta": {
            "type": "object"
          }
        }
      }
    }
  }
}
